삼화전기, 전기 제품, 4.4, 6, - 콘덴서 등 부품. 트랜스포머, 파워인덕터, 욕심. X, 신고가. 약 눌림.
LS ELECTRIC, 전기장비, 50, 전력기기 시스템의 제조 및 공급. 기타등등 문어발식... 약눌림. 이정도는 상승기류를 탈때가지 대기.
아모레퍼시픽, 화장품, 98, 2.5, 굴곡이 있기는 한데 무거운 주. 약 눌림.
와이씨, 반도체장비, 12, 3.4, 고속 메모리 테스터 검사장비. 삼성 HBM 관련. 투자경고 예고. 눌림중... 더 가려나? 약눌림.
HB솔루션, 디스플레이 장비부품, 5, 0.4, 반도체. 검사,측정 장비를 생산. OLED 아이패드??? 포지션 애매. 차트는 진짜 애매하네.
삼양식품, 식품, 23, 3, ??? 수지스링크 삼양식품과 대체육 시장??? 52신고가.
제주은행, 은행, 4, 2.2, ????
티에스이, 반도체장비, 8, 4.3, 반도체검사장비, 누림 후 반등 전고점
실리콘투, 인터넷소매, 12, 30, 화장품 테마, stylekorean.com, 150 E-commerce, AGV 물류로봇. 역대급 실적 상한가.



, 티에스이, 눌림중, 반도체는 이르기는 하지만... 단골.
, HB솔루션, 강한 눌림, 폭락 이력이 보이고, 하락 후 반등이라 일단 대상. 아이패드OLED,
, 와이씨, 이격도 강함, 신고, 눌림 반등, 반도체, HBM 뉴스 이슈.

, 삼화전기, 전기 테마가...
, 실리콘투, 흠... 일단 실적은... 보자.

, 무겁거나 테마가 상승 대상이 아님.
, 제주은행, 삼양식품, 아모레퍼시픽, LS ELECTRIC


, 테마를 고려하면 상승을 이끌 동력원이 없다면 일단은 반도체.


, 반도체, 화장품, 전기, 디스플레이.
, 다양하네... 이건 대상 조회이니까...



, 원칙 정리
, 테마 끝물인데 더 먹으려고 욕심부리지 말자.
, 세력에 의한 올라타기 이지, 이겨 먹을 생각은... 장초반 거래량을 확인해야... 쉽지 않네.



, 삼화전기 차트 정리.
, 신고가를 경신했지만... 그만한 가치를 가지고 있는가? 하지만 오르기는 많이 했네.
, 뉴스를 보면 이슈는 없음. 차트는 오를 만큼 오른거 같고... 대장주는 아님.




, 차트 정리
, 보고 싶은 것들...
, 거래량과 거래대금. 빠르게 모아볼수 있을까??? ㅜ.ㅜ 추세를 보고 싶어지네...
, 


, 한편 전 거래일 반도체 장비 관련주인 리튬포어스 코미코 한미반도체, 신성이엔지 아이엠티, 디아이티, 테크윙, HPSP, AP시스템, 이오테크닉스, 에스티아이, 제우스, 인텍플러스, 한미반도체, 프로텍, 네온테크, 에이피티씨, 제너셈, 테스, 피에스케이홀딩스, 더코디, 엘오티베큠, 예스티, 고영, 하나마이크론, 한화에어로스페이스, 유니셈, 오로스테크놀로지, 와이아이케이, 피에스케이, 티에스이, 엑시콘, 싸이맥스 디아이, 유진테크, GST, 티에프이, 네패스아크, 제이스텍, 유니테스트, 성우테크론, 저스템, 넥스틴,  제이티, 코미코, 러셀, HB테크놀러지, 라온테크,  SFA반도체, 에프에스티, 디바이스이엔지, 자비스, 서플러스글로벌, 탑엔지니어링, 주성엔지니어링, 에이팩트, 네오셈, 케이씨텍, 성도이엔지, 엔투텍, 케이엔솔, 기가비스, 레이저쎌, 신성이엔지, 프로이천, 기가레인, 에스엔유, 코세스, 코디, 펨트론, 위드텍, 티씨케이, , 아스플로, 리튬포어스, 오션브릿지 코세스 한양이엔지 로보스타 미래산업 탑엔지니어링 알에스오토메이션 로체시스템즈 싸이맥스 엑시콘 제이엔비 그린리소스 한양이엔지 씨앤지하이테크 에이티피씨 케이엔솔 서진시스템 위드텍 지앤비에스 에코 저스템 에스에프에이 포인트엔지니어링 원익IPS 리노공업 팸텍은 대부분 크게 출렁 거렸다.

